{
  "entries": [
    {
      "id": "ej_17.12.2025_ensemble_champion_1766139816.374832",
      "date": "2025-12-19T10:23:36.374878",
      "draw_date": "17.12.2025",
      "predicted_numbers": [
        38,
        11,
        14,
        22,
        26
      ],
      "actual_numbers": [
        32,
        34,
        13,
        14,
        20
      ],
      "main_matches": 1,
      "predicted_euro": [
        11,
        7
      ],
      "actual_euro": [
        2,
        11
      ],
      "euro_matches": 1,
      "gewinnklasse": null,
      "method": "ensemble_champion",
      "provider": "ensemble",
      "confidence": 90,
      "strategy": "Gewichtetes Voting aus 15 KI-Vorhersagen"
    },
    {
      "id": "ej_17.12.2025_ej_hot_cold_1766139816.374935",
      "date": "2025-12-19T10:23:36.374937",
      "draw_date": "17.12.2025",
      "predicted_numbers": [
        38,
        14,
        18,
        50,
        26
      ],
      "actual_numbers": [
        32,
        34,
        13,
        14,
        20
      ],
      "main_matches": 1,
      "predicted_euro": [
        8,
        2
      ],
      "actual_euro": [
        2,
        11
      ],
      "euro_matches": 1,
      "gewinnklasse": null,
      "method": "ej_hot_cold",
      "provider": "local_ml",
      "confidence": 80.0,
      "strategy": "Basiert auf den h\u00e4ufigsten Zahlen"
    },
    {
      "id": "ej_17.12.2025_ej_cold_1766139816.374972",
      "date": "2025-12-19T10:23:36.374978",
      "draw_date": "17.12.2025",
      "predicted_numbers": [
        1,
        5,
        43,
        20,
        31
      ],
      "actual_numbers": [
        32,
        34,
        13,
        14,
        20
      ],
      "main_matches": 1,
      "predicted_euro": [
        6,
        7
      ],
      "actual_euro": [
        2,
        11
      ],
      "euro_matches": 0,
      "gewinnklasse": null,
      "method": "ej_cold",
      "provider": "local_ml",
      "confidence": 80.0,
      "strategy": "Seltener gezogene Zahlen"
    },
    {
      "id": "ej_17.12.2025_ej_overdue_1766139816.375006",
      "date": "2025-12-19T10:23:36.375007",
      "draw_date": "17.12.2025",
      "predicted_numbers": [
        1,
        43,
        48,
        17,
        49
      ],
      "actual_numbers": [
        32,
        34,
        13,
        14,
        20
      ],
      "main_matches": 0,
      "predicted_euro": [
        4,
        7
      ],
      "actual_euro": [
        2,
        11
      ],
      "euro_matches": 0,
      "gewinnklasse": null,
      "method": "ej_overdue",
      "provider": "local_ml",
      "confidence": 80.0,
      "strategy": "Zahlen die lange nicht kamen"
    },
    {
      "id": "ej_17.12.2025_ej_odd_even_32_1766139816.375034",
      "date": "2025-12-19T10:23:36.375035",
      "draw_date": "17.12.2025",
      "predicted_numbers": [
        34,
        11,
        14,
        21,
        29
      ],
      "actual_numbers": [
        32,
        34,
        13,
        14,
        20
      ],
      "main_matches": 2,
      "predicted_euro": [
        9,
        11
      ],
      "actual_euro": [
        2,
        11
      ],
      "euro_matches": 1,
      "gewinnklasse": 12,
      "method": "ej_odd_even_32",
      "provider": "local_ml",
      "confidence": 80.0,
      "strategy": "Optimale Gerade/Ungerade-Balance"
    },
    {
      "id": "ej_17.12.2025_ej_odd_even_23_1766139816.37508",
      "date": "2025-12-19T10:23:36.375082",
      "draw_date": "17.12.2025",
      "predicted_numbers": [
        44,
        45,
        24,
        25,
        26
      ],
      "actual_numbers": [
        32,
        34,
        13,
        14,
        20
      ],
      "main_matches": 0,
      "predicted_euro": [
        11,
        3
      ],
      "actual_euro": [
        2,
        11
      ],
      "euro_matches": 1,
      "gewinnklasse": null,
      "method": "ej_odd_even_23",
      "provider": "local_ml",
      "confidence": 80.0,
      "strategy": "Alternative Gerade/Ungerade-Balance"
    },
    {
      "id": "ej_17.12.2025_ej_sum_optimized_1766139816.375107",
      "date": "2025-12-19T10:23:36.375109",
      "draw_date": "17.12.2025",
      "predicted_numbers": [
        34,
        12,
        21,
        24,
        26
      ],
      "actual_numbers": [
        32,
        34,
        13,
        14,
        20
      ],
      "main_matches": 1,
      "predicted_euro": [
        10,
        12
      ],
      "actual_euro": [
        2,
        11
      ],
      "euro_matches": 0,
      "gewinnklasse": null,
      "method": "ej_sum_optimized",
      "provider": "local_ml",
      "confidence": 80.0,
      "strategy": "Optimiert auf typische Summen"
    },
    {
      "id": "ej_17.12.2025_ej_decade_balance_1766139816.375141",
      "date": "2025-12-19T10:23:36.375142",
      "draw_date": "17.12.2025",
      "predicted_numbers": [
        1,
        34,
        44,
        14,
        18
      ],
      "actual_numbers": [
        32,
        34,
        13,
        14,
        20
      ],
      "main_matches": 2,
      "predicted_euro": [
        2,
        11
      ],
      "actual_euro": [
        2,
        11
      ],
      "euro_matches": 2,
      "gewinnklasse": 8,
      "method": "ej_decade_balance",
      "provider": "local_ml",
      "confidence": 80.0,
      "strategy": "Verteilt \u00fcber alle 10er-Gruppen"
    },
    {
      "id": "ej_17.12.2025_ej_delta_1766139816.37518",
      "date": "2025-12-19T10:23:36.375182",
      "draw_date": "17.12.2025",
      "predicted_numbers": [
        33,
        11,
        19,
        22,
        29
      ],
      "actual_numbers": [
        32,
        34,
        13,
        14,
        20
      ],
      "main_matches": 0,
      "predicted_euro": [
        12,
        5
      ],
      "actual_euro": [
        2,
        11
      ],
      "euro_matches": 0,
      "gewinnklasse": null,
      "method": "ej_delta",
      "provider": "local_ml",
      "confidence": 80.0,
      "strategy": "Basiert auf typischen Abst\u00e4nden"
    },
    {
      "id": "ej_17.12.2025_ej_position_1766139816.375205",
      "date": "2025-12-19T10:23:36.375206",
      "draw_date": "17.12.2025",
      "predicted_numbers": [
        6,
        39,
        49,
        22,
        29
      ],
      "actual_numbers": [
        32,
        34,
        13,
        14,
        20
      ],
      "main_matches": 0,
      "predicted_euro": [
        9,
        10
      ],
      "actual_euro": [
        2,
        11
      ],
      "euro_matches": 0,
      "gewinnklasse": null,
      "method": "ej_position",
      "provider": "local_ml",
      "confidence": 80.0,
      "strategy": "Typische Bereiche pro Position"
    },
    {
      "id": "ej_17.12.2025_ej_no_consecutive_1766139816.37528",
      "date": "2025-12-19T10:23:36.375282",
      "draw_date": "17.12.2025",
      "predicted_numbers": [
        38,
        45,
        50,
        22,
        25
      ],
      "actual_numbers": [
        32,
        34,
        13,
        14,
        20
      ],
      "main_matches": 0,
      "predicted_euro": [
        10,
        5
      ],
      "actual_euro": [
        2,
        11
      ],
      "euro_matches": 0,
      "gewinnklasse": null,
      "method": "ej_no_consecutive",
      "provider": "local_ml",
      "confidence": 80.0,
      "strategy": "Vermeidet aufeinanderfolgende"
    },
    {
      "id": "ej_17.12.2025_ej_prime_mix_1766139816.375314",
      "date": "2025-12-19T10:23:36.375315",
      "draw_date": "17.12.2025",
      "predicted_numbers": [
        34,
        7,
        9,
        19,
        26
      ],
      "actual_numbers": [
        32,
        34,
        13,
        14,
        20
      ],
      "main_matches": 1,
      "predicted_euro": [
        2,
        11
      ],
      "actual_euro": [
        2,
        11
      ],
      "euro_matches": 2,
      "gewinnklasse": 11,
      "method": "ej_prime_mix",
      "provider": "local_ml",
      "confidence": 80.0,
      "strategy": "2 Primzahlen + 3 andere"
    },
    {
      "id": "ej_17.12.2025_ej_low_high_1766139816.375335",
      "date": "2025-12-19T10:23:36.375339",
      "draw_date": "17.12.2025",
      "predicted_numbers": [
        38,
        11,
        21,
        22,
        26
      ],
      "actual_numbers": [
        32,
        34,
        13,
        14,
        20
      ],
      "main_matches": 0,
      "predicted_euro": [
        12,
        5
      ],
      "actual_euro": [
        2,
        11
      ],
      "euro_matches": 0,
      "gewinnklasse": null,
      "method": "ej_low_high",
      "provider": "local_ml",
      "confidence": 80.0,
      "strategy": "3 niedrige + 2 hohe Zahlen"
    },
    {
      "id": "ej_17.12.2025_ej_hot_cold_mix_1766139816.37536",
      "date": "2025-12-19T10:23:36.375361",
      "draw_date": "17.12.2025",
      "predicted_numbers": [
        38,
        43,
        12,
        19,
        22
      ],
      "actual_numbers": [
        32,
        34,
        13,
        14,
        20
      ],
      "main_matches": 0,
      "predicted_euro": [
        8,
        7
      ],
      "actual_euro": [
        2,
        11
      ],
      "euro_matches": 0,
      "gewinnklasse": null,
      "method": "ej_hot_cold_mix",
      "provider": "local_ml",
      "confidence": 80.0,
      "strategy": "3 hei\u00dfe + 2 kalte Zahlen"
    },
    {
      "id": "ej_17.12.2025_ej_monte_carlo_1766139816.375381",
      "date": "2025-12-19T10:23:36.375382",
      "draw_date": "17.12.2025",
      "predicted_numbers": [
        11,
        44,
        45,
        18,
        25
      ],
      "actual_numbers": [
        32,
        34,
        13,
        14,
        20
      ],
      "main_matches": 0,
      "predicted_euro": [
        9,
        5
      ],
      "actual_euro": [
        2,
        11
      ],
      "euro_matches": 0,
      "gewinnklasse": null,
      "method": "ej_monte_carlo",
      "provider": "local_ml",
      "confidence": 80.0,
      "strategy": "1000 Simulationen"
    },
    {
      "id": "ej_17.12.2025_ej_bayesian_1766139816.3754",
      "date": "2025-12-19T10:23:36.375401",
      "draw_date": "17.12.2025",
      "predicted_numbers": [
        33,
        14,
        21,
        22,
        25
      ],
      "actual_numbers": [
        32,
        34,
        13,
        14,
        20
      ],
      "main_matches": 1,
      "predicted_euro": [
        11,
        7
      ],
      "actual_euro": [
        2,
        11
      ],
      "euro_matches": 1,
      "gewinnklasse": null,
      "method": "ej_bayesian",
      "provider": "local_ml",
      "confidence": 80.0,
      "strategy": "Wahrscheinlichkeitsberechnung"
    },
    {
      "id": "ej_23.12.2025_ml_ensemble_real_1766521148.485067",
      "date": "2025-12-23T20:19:08.485077",
      "draw_date": "23.12.2025",
      "predicted_numbers": [
        12,
        13,
        50,
        20,
        25
      ],
      "actual_numbers": [
        35,
        8,
        42,
        12,
        20
      ],
      "main_matches": 2,
      "predicted_euro": [
        9,
        6
      ],
      "actual_euro": [
        3,
        12
      ],
      "euro_matches": 0,
      "gewinnklasse": null,
      "method": "ml_ensemble_real",
      "provider": "ml_real",
      "confidence": 85,
      "strategy": "Gewichtetes Voting aus Neural Network, Markov & Bayesian"
    },
    {
      "id": "ej_23.12.2025_ensemble_champion_1766521148.485109",
      "date": "2025-12-23T20:19:08.485111",
      "draw_date": "23.12.2025",
      "predicted_numbers": [
        50,
        21,
        22,
        25,
        26
      ],
      "actual_numbers": [
        35,
        8,
        42,
        12,
        20
      ],
      "main_matches": 0,
      "predicted_euro": [
        9,
        2
      ],
      "actual_euro": [
        3,
        12
      ],
      "euro_matches": 0,
      "gewinnklasse": null,
      "method": "ensemble_champion",
      "provider": "ensemble",
      "confidence": 90,
      "strategy": "Gewichtetes Voting aus 19 KI-Vorhersagen"
    },
    {
      "id": "ej_23.12.2025_ml_bayesian_real_1766521148.48513",
      "date": "2025-12-23T20:19:08.485132",
      "draw_date": "23.12.2025",
      "predicted_numbers": [
        38,
        45,
        50,
        25,
        26
      ],
      "actual_numbers": [
        35,
        8,
        42,
        12,
        20
      ],
      "main_matches": 0,
      "predicted_euro": [
        2,
        11
      ],
      "actual_euro": [
        3,
        12
      ],
      "euro_matches": 0,
      "gewinnklasse": null,
      "method": "ml_bayesian_real",
      "provider": "ml_real",
      "confidence": 75,
      "strategy": "Echtes ML: bayesian"
    },
    {
      "id": "ej_23.12.2025_ml_markov_real_1766521148.485148",
      "date": "2025-12-23T20:19:08.485150",
      "draw_date": "23.12.2025",
      "predicted_numbers": [
        39,
        50,
        22,
        25,
        29
      ],
      "actual_numbers": [
        35,
        8,
        42,
        12,
        20
      ],
      "main_matches": 0,
      "predicted_euro": [
        1,
        3
      ],
      "actual_euro": [
        3,
        12
      ],
      "euro_matches": 1,
      "gewinnklasse": null,
      "method": "ml_markov_real",
      "provider": "ml_real",
      "confidence": 31.774911457975705,
      "strategy": "Echtes ML: markov"
    },
    {
      "id": "ej_23.12.2025_ml_neural_network_real_1766521148.485169",
      "date": "2025-12-23T20:19:08.485171",
      "draw_date": "23.12.2025",
      "predicted_numbers": [
        12,
        13,
        46,
        49,
        20
      ],
      "actual_numbers": [
        35,
        8,
        42,
        12,
        20
      ],
      "main_matches": 2,
      "predicted_euro": [
        9,
        6
      ],
      "actual_euro": [
        3,
        12
      ],
      "euro_matches": 0,
      "gewinnklasse": null,
      "method": "ml_neural_network_real",
      "provider": "ml_real",
      "confidence": 3.1828054425777954,
      "strategy": "Echtes ML: neural_network"
    },
    {
      "id": "ej_23.12.2025_ej_decade_balance_1766521148.485191",
      "date": "2025-12-23T20:19:08.485193",
      "draw_date": "23.12.2025",
      "predicted_numbers": [
        4,
        14,
        50,
        21,
        25
      ],
      "actual_numbers": [
        35,
        8,
        42,
        12,
        20
      ],
      "main_matches": 0,
      "predicted_euro": [
        1,
        10
      ],
      "actual_euro": [
        3,
        12
      ],
      "euro_matches": 0,
      "gewinnklasse": null,
      "method": "ej_decade_balance",
      "provider": "local_ml",
      "confidence": 81.8,
      "strategy": "Verteilt \u00fcber alle 10er-Gruppen"
    },
    {
      "id": "ej_23.12.2025_ej_prime_mix_1766521148.485211",
      "date": "2025-12-23T20:19:08.485213",
      "draw_date": "23.12.2025",
      "predicted_numbers": [
        44,
        45,
        13,
        16,
        31
      ],
      "actual_numbers": [
        35,
        8,
        42,
        12,
        20
      ],
      "main_matches": 0,
      "predicted_euro": [
        8,
        5
      ],
      "actual_euro": [
        3,
        12
      ],
      "euro_matches": 0,
      "gewinnklasse": null,
      "method": "ej_prime_mix",
      "provider": "local_ml",
      "confidence": 81.2,
      "strategy": "2 Primzahlen + 3 andere"
    },
    {
      "id": "ej_23.12.2025_ej_odd_even_32_1766521148.485243",
      "date": "2025-12-23T20:19:08.485245",
      "draw_date": "23.12.2025",
      "predicted_numbers": [
        38,
        11,
        12,
        21,
        29
      ],
      "actual_numbers": [
        35,
        8,
        42,
        12,
        20
      ],
      "main_matches": 1,
      "predicted_euro": [
        2,
        11
      ],
      "actual_euro": [
        3,
        12
      ],
      "euro_matches": 0,
      "gewinnklasse": null,
      "method": "ej_odd_even_32",
      "provider": "local_ml",
      "confidence": 80.9,
      "strategy": "Optimale Gerade/Ungerade-Balance"
    },
    {
      "id": "ej_24.12.2025_ml_ensemble_real_1766603990.38629",
      "date": "2025-12-24T19:19:50.386299",
      "draw_date": "24.12.2025",
      "predicted_numbers": [
        32,
        38,
        11,
        18,
        50
      ],
      "actual_numbers": [
        1,
        34,
        33,
        13,
        50
      ],
      "main_matches": 1,
      "predicted_euro": [
        2,
        6
      ],
      "actual_euro": [
        11,
        12
      ],
      "euro_matches": 0,
      "gewinnklasse": null,
      "method": "ml_ensemble_real",
      "provider": "ml_real",
      "confidence": 88,
      "strategy": "Gewichtetes Voting aus Neural Network, Markov, Bayesian & EurozahlML"
    },
    {
      "id": "ej_24.12.2025_ensemble_champion_1766603990.386329",
      "date": "2025-12-24T19:19:50.386331",
      "draw_date": "24.12.2025",
      "predicted_numbers": [
        32,
        4,
        45,
        18,
        50
      ],
      "actual_numbers": [
        1,
        34,
        33,
        13,
        50
      ],
      "main_matches": 1,
      "predicted_euro": [
        2,
        6
      ],
      "actual_euro": [
        11,
        12
      ],
      "euro_matches": 0,
      "gewinnklasse": null,
      "method": "ensemble_champion",
      "provider": "ensemble",
      "confidence": 90,
      "strategy": "Gewichtetes Voting aus 21 KI-Vorhersagen"
    },
    {
      "id": "ej_24.12.2025_ml_bayesian_real_1766603990.386353",
      "date": "2025-12-24T19:19:50.386355",
      "draw_date": "24.12.2025",
      "predicted_numbers": [
        44,
        18,
        50,
        25,
        29
      ],
      "actual_numbers": [
        1,
        34,
        33,
        13,
        50
      ],
      "main_matches": 1,
      "predicted_euro": [
        2,
        3
      ],
      "actual_euro": [
        11,
        12
      ],
      "euro_matches": 0,
      "gewinnklasse": null,
      "method": "ml_bayesian_real",
      "provider": "ml_real",
      "confidence": 75,
      "strategy": "Echtes ML: bayesian"
    },
    {
      "id": "ej_24.12.2025_ml_reinforcement_real_1766603990.38637",
      "date": "2025-12-24T19:19:50.386403",
      "draw_date": "24.12.2025",
      "predicted_numbers": [
        32,
        38,
        11,
        18,
        50
      ],
      "actual_numbers": [
        1,
        34,
        33,
        13,
        50
      ],
      "main_matches": 1,
      "predicted_euro": [
        2,
        6
      ],
      "actual_euro": [
        11,
        12
      ],
      "euro_matches": 0,
      "gewinnklasse": null,
      "method": "ml_reinforcement_real",
      "provider": "ml_real",
      "confidence": 75,
      "strategy": "Beste Strategie: ml_ensemble"
    },
    {
      "id": "ej_24.12.2025_ml_markov_real_1766603990.386424",
      "date": "2025-12-24T19:19:50.386426",
      "draw_date": "24.12.2025",
      "predicted_numbers": [
        45,
        50,
        21,
        22,
        30
      ],
      "actual_numbers": [
        1,
        34,
        33,
        13,
        50
      ],
      "main_matches": 1,
      "predicted_euro": [
        8,
        2
      ],
      "actual_euro": [
        11,
        12
      ],
      "euro_matches": 0,
      "gewinnklasse": null,
      "method": "ml_markov_real",
      "provider": "ml_real",
      "confidence": 31.363418805187816,
      "strategy": "Echtes ML: markov"
    },
    {
      "id": "ej_24.12.2025_ml_eurozahl_real_1766603990.386441",
      "date": "2025-12-24T19:19:50.386444",
      "draw_date": "24.12.2025",
      "predicted_numbers": [
        32,
        38,
        11,
        18,
        50
      ],
      "actual_numbers": [
        1,
        34,
        33,
        13,
        50
      ],
      "main_matches": 1,
      "predicted_euro": [
        2,
        6
      ],
      "actual_euro": [
        11,
        12
      ],
      "euro_matches": 0,
      "gewinnklasse": null,
      "method": "ml_eurozahl_real",
      "provider": "ml_real",
      "confidence": 9.772214321444292,
      "strategy": "Spezialisiertes ML f\u00fcr 2 aus 12 mit Paar-Analyse"
    },
    {
      "id": "ej_24.12.2025_ml_neural_network_real_1766603990.386459",
      "date": "2025-12-24T19:19:50.386461",
      "draw_date": "24.12.2025",
      "predicted_numbers": [
        32,
        38,
        11,
        46,
        18
      ],
      "actual_numbers": [
        1,
        34,
        33,
        13,
        50
      ],
      "main_matches": 0,
      "predicted_euro": [
        9,
        6
      ],
      "actual_euro": [
        11,
        12
      ],
      "euro_matches": 0,
      "gewinnklasse": null,
      "method": "ml_neural_network_real",
      "provider": "ml_real",
      "confidence": 2.639762329071248,
      "strategy": "Echtes ML: neural_network"
    },
    {
      "id": "ej_24.12.2025_ej_hot_cold_1766603990.386498",
      "date": "2025-12-24T19:19:50.386500",
      "draw_date": "24.12.2025",
      "predicted_numbers": [
        36,
        9,
        42,
        49,
        31
      ],
      "actual_numbers": [
        1,
        34,
        33,
        13,
        50
      ],
      "main_matches": 0,
      "predicted_euro": [
        8,
        6
      ],
      "actual_euro": [
        11,
        12
      ],
      "euro_matches": 0,
      "gewinnklasse": null,
      "method": "ej_hot_cold",
      "provider": "local_ml",
      "confidence": 78.5,
      "strategy": "Basiert auf den h\u00e4ufigsten Zahlen"
    },
    {
      "id": "ej_26.12.2025_ml_ensemble_real_1766780351.293999",
      "date": "2025-12-26T20:19:11.294008",
      "draw_date": "26.12.2025",
      "predicted_numbers": [
        38,
        21,
        22,
        24,
        29
      ],
      "actual_numbers": [
        39,
        40,
        43,
        12,
        17
      ],
      "main_matches": 0,
      "predicted_euro": [
        9,
        2
      ],
      "actual_euro": [
        1,
        12
      ],
      "euro_matches": 0,
      "gewinnklasse": null,
      "method": "ml_ensemble_real",
      "provider": "ml_real",
      "confidence": 88,
      "strategy": "Gewichtetes Voting aus Neural Network, Markov, Bayesian & EurozahlML"
    },
    {
      "id": "ej_26.12.2025_ensemble_champion_1766780351.294036",
      "date": "2025-12-26T20:19:11.294038",
      "draw_date": "26.12.2025",
      "predicted_numbers": [
        41,
        45,
        21,
        22,
        24
      ],
      "actual_numbers": [
        39,
        40,
        43,
        12,
        17
      ],
      "main_matches": 0,
      "predicted_euro": [
        2,
        7
      ],
      "actual_euro": [
        1,
        12
      ],
      "euro_matches": 0,
      "gewinnklasse": null,
      "method": "ensemble_champion",
      "provider": "ensemble",
      "confidence": 90,
      "strategy": "Gewichtetes Voting aus 21 KI-Vorhersagen"
    },
    {
      "id": "ej_26.12.2025_ml_bayesian_real_1766780351.29406",
      "date": "2025-12-26T20:19:11.294062",
      "draw_date": "26.12.2025",
      "predicted_numbers": [
        38,
        21,
        22,
        25,
        29
      ],
      "actual_numbers": [
        39,
        40,
        43,
        12,
        17
      ],
      "main_matches": 0,
      "predicted_euro": [
        1,
        2
      ],
      "actual_euro": [
        1,
        12
      ],
      "euro_matches": 1,
      "gewinnklasse": null,
      "method": "ml_bayesian_real",
      "provider": "ml_real",
      "confidence": 75,
      "strategy": "Echtes ML: bayesian"
    },
    {
      "id": "ej_26.12.2025_ml_reinforcement_real_1766780351.294115",
      "date": "2025-12-26T20:19:11.294117",
      "draw_date": "26.12.2025",
      "predicted_numbers": [
        38,
        21,
        22,
        24,
        29
      ],
      "actual_numbers": [
        39,
        40,
        43,
        12,
        17
      ],
      "main_matches": 0,
      "predicted_euro": [
        9,
        2
      ],
      "actual_euro": [
        1,
        12
      ],
      "euro_matches": 0,
      "gewinnklasse": null,
      "method": "ml_reinforcement_real",
      "provider": "ml_real",
      "confidence": 75,
      "strategy": "Beste Strategie: ml_ensemble"
    },
    {
      "id": "ej_26.12.2025_ml_markov_real_1766780351.294132",
      "date": "2025-12-26T20:19:11.294134",
      "draw_date": "26.12.2025",
      "predicted_numbers": [
        38,
        18,
        22,
        24,
        29
      ],
      "actual_numbers": [
        39,
        40,
        43,
        12,
        17
      ],
      "main_matches": 0,
      "predicted_euro": [
        8,
        2
      ],
      "actual_euro": [
        1,
        12
      ],
      "euro_matches": 0,
      "gewinnklasse": null,
      "method": "ml_markov_real",
      "provider": "ml_real",
      "confidence": 28.813212504725733,
      "strategy": "Echtes ML: markov"
    },
    {
      "id": "ej_26.12.2025_ml_eurozahl_real_1766780351.294151",
      "date": "2025-12-26T20:19:11.294153",
      "draw_date": "26.12.2025",
      "predicted_numbers": [
        38,
        21,
        22,
        24,
        29
      ],
      "actual_numbers": [
        39,
        40,
        43,
        12,
        17
      ],
      "main_matches": 0,
      "predicted_euro": [
        9,
        7
      ],
      "actual_euro": [
        1,
        12
      ],
      "euro_matches": 0,
      "gewinnklasse": null,
      "method": "ml_eurozahl_real",
      "provider": "ml_real",
      "confidence": 9.516900422434121,
      "strategy": "Spezialisiertes ML f\u00fcr 2 aus 12 mit Paar-Analyse"
    },
    {
      "id": "ej_26.12.2025_ml_neural_network_real_1766780351.294166",
      "date": "2025-12-26T20:19:11.294168",
      "draw_date": "26.12.2025",
      "predicted_numbers": [
        42,
        43,
        45,
        21,
        24
      ],
      "actual_numbers": [
        39,
        40,
        43,
        12,
        17
      ],
      "main_matches": 1,
      "predicted_euro": [
        9,
        6
      ],
      "actual_euro": [
        1,
        12
      ],
      "euro_matches": 0,
      "gewinnklasse": null,
      "method": "ml_neural_network_real",
      "provider": "ml_real",
      "confidence": 4.172752569393326,
      "strategy": "Echtes ML: neural_network"
    },
    {
      "id": "ej_26.12.2025_ej_bayesian_1766780351.294198",
      "date": "2025-12-26T20:19:11.294200",
      "draw_date": "26.12.2025",
      "predicted_numbers": [
        41,
        43,
        12,
        49,
        27
      ],
      "actual_numbers": [
        39,
        40,
        43,
        12,
        17
      ],
      "main_matches": 2,
      "predicted_euro": [
        10,
        3
      ],
      "actual_euro": [
        1,
        12
      ],
      "euro_matches": 0,
      "gewinnklasse": null,
      "method": "ej_bayesian",
      "provider": "local_ml",
      "confidence": 78.5,
      "strategy": "Wahrscheinlichkeitsberechnung"
    },
    {
      "id": "ej_27.12.2025_ml_ensemble_real_1766866576.541253",
      "date": "2025-12-27T20:16:16.541263",
      "draw_date": "27.12.2025",
      "predicted_numbers": [
        36,
        42,
        50,
        21,
        24
      ],
      "actual_numbers": [
        47,
        20,
        22,
        24,
        30
      ],
      "main_matches": 1,
      "predicted_euro": [
        8,
        9
      ],
      "actual_euro": [
        3,
        4
      ],
      "euro_matches": 0,
      "gewinnklasse": null,
      "method": "ml_ensemble_real",
      "provider": "ml_real",
      "confidence": 88,
      "strategy": "Gewichtetes Voting aus Neural Network, Markov, Bayesian & EurozahlML"
    },
    {
      "id": "ej_27.12.2025_ensemble_champion_1766866576.541293",
      "date": "2025-12-27T20:16:16.541296",
      "draw_date": "27.12.2025",
      "predicted_numbers": [
        36,
        5,
        50,
        18,
        21
      ],
      "actual_numbers": [
        47,
        20,
        22,
        24,
        30
      ],
      "main_matches": 0,
      "predicted_euro": [
        8,
        4
      ],
      "actual_euro": [
        3,
        4
      ],
      "euro_matches": 1,
      "gewinnklasse": null,
      "method": "ensemble_champion",
      "provider": "ensemble",
      "confidence": 90,
      "strategy": "Gewichtetes Voting aus 21 KI-Vorhersagen"
    },
    {
      "id": "ej_27.12.2025_ml_bayesian_real_1766866576.541314",
      "date": "2025-12-27T20:16:16.541316",
      "draw_date": "27.12.2025",
      "predicted_numbers": [
        50,
        21,
        22,
        25,
        29
      ],
      "actual_numbers": [
        47,
        20,
        22,
        24,
        30
      ],
      "main_matches": 1,
      "predicted_euro": [
        8,
        2
      ],
      "actual_euro": [
        3,
        4
      ],
      "euro_matches": 0,
      "gewinnklasse": null,
      "method": "ml_bayesian_real",
      "provider": "ml_real",
      "confidence": 75,
      "strategy": "Echtes ML: bayesian"
    },
    {
      "id": "ej_27.12.2025_ml_reinforcement_real_1766866576.541332",
      "date": "2025-12-27T20:16:16.541334",
      "draw_date": "27.12.2025",
      "predicted_numbers": [
        36,
        42,
        50,
        21,
        24
      ],
      "actual_numbers": [
        47,
        20,
        22,
        24,
        30
      ],
      "main_matches": 1,
      "predicted_euro": [
        8,
        9
      ],
      "actual_euro": [
        3,
        4
      ],
      "euro_matches": 0,
      "gewinnklasse": null,
      "method": "ml_reinforcement_real",
      "provider": "ml_real",
      "confidence": 75,
      "strategy": "Beste Strategie: ml_ensemble"
    },
    {
      "id": "ej_27.12.2025_ml_markov_real_1766866576.541353",
      "date": "2025-12-27T20:16:16.541355",
      "draw_date": "27.12.2025",
      "predicted_numbers": [
        34,
        11,
        44,
        45,
        50
      ],
      "actual_numbers": [
        47,
        20,
        22,
        24,
        30
      ],
      "main_matches": 0,
      "predicted_euro": [
        8,
        2
      ],
      "actual_euro": [
        3,
        4
      ],
      "euro_matches": 0,
      "gewinnklasse": null,
      "method": "ml_markov_real",
      "provider": "ml_real",
      "confidence": 29.51542457277202,
      "strategy": "Echtes ML: markov"
    },
    {
      "id": "ej_27.12.2025_ml_eurozahl_real_1766866576.54137",
      "date": "2025-12-27T20:16:16.541372",
      "draw_date": "27.12.2025",
      "predicted_numbers": [
        36,
        42,
        50,
        21,
        24
      ],
      "actual_numbers": [
        47,
        20,
        22,
        24,
        30
      ],
      "main_matches": 1,
      "predicted_euro": [
        9,
        3
      ],
      "actual_euro": [
        3,
        4
      ],
      "euro_matches": 1,
      "gewinnklasse": null,
      "method": "ml_eurozahl_real",
      "provider": "ml_real",
      "confidence": 9.816556093522486,
      "strategy": "Spezialisiertes ML f\u00fcr 2 aus 12 mit Paar-Analyse"
    },
    {
      "id": "ej_27.12.2025_ml_neural_network_real_1766866576.541389",
      "date": "2025-12-27T20:16:16.541391",
      "draw_date": "27.12.2025",
      "predicted_numbers": [
        36,
        42,
        43,
        21,
        24
      ],
      "actual_numbers": [
        47,
        20,
        22,
        24,
        30
      ],
      "main_matches": 1,
      "predicted_euro": [
        8,
        9
      ],
      "actual_euro": [
        3,
        4
      ],
      "euro_matches": 0,
      "gewinnklasse": null,
      "method": "ml_neural_network_real",
      "provider": "ml_real",
      "confidence": 4.230339263266228,
      "strategy": "Echtes ML: neural_network"
    },
    {
      "id": "ej_27.12.2025_ej_decade_balance_1766866576.541423",
      "date": "2025-12-27T20:16:16.541426",
      "draw_date": "27.12.2025",
      "predicted_numbers": [
        37,
        8,
        47,
        18,
        26
      ],
      "actual_numbers": [
        47,
        20,
        22,
        24,
        30
      ],
      "main_matches": 1,
      "predicted_euro": [
        2,
        5
      ],
      "actual_euro": [
        3,
        4
      ],
      "euro_matches": 0,
      "gewinnklasse": null,
      "method": "ej_decade_balance",
      "provider": "local_ml",
      "confidence": 78.4,
      "strategy": "Verteilt \u00fcber alle 10er-Gruppen"
    },
    {
      "id": "ej_28.12.2025_ml_ensemble_real_1766893783.733109",
      "date": "2025-12-28T03:49:43.733119",
      "draw_date": "28.12.2025",
      "predicted_numbers": [
        21,
        24,
        25,
        28,
        29
      ],
      "actual_numbers": [
        2,
        4,
        11,
        48,
        31
      ],
      "main_matches": 0,
      "predicted_euro": [
        9,
        12
      ],
      "actual_euro": [
        1,
        12
      ],
      "euro_matches": 1,
      "gewinnklasse": null,
      "method": "ml_ensemble_real",
      "provider": "ml_real",
      "confidence": 88,
      "strategy": "Gewichtetes Voting aus Neural Network, Markov, Bayesian & EurozahlML"
    },
    {
      "id": "ej_28.12.2025_ensemble_champion_1766893783.733149",
      "date": "2025-12-28T03:49:43.733152",
      "draw_date": "28.12.2025",
      "predicted_numbers": [
        16,
        21,
        24,
        25,
        29
      ],
      "actual_numbers": [
        2,
        4,
        11,
        48,
        31
      ],
      "main_matches": 0,
      "predicted_euro": [
        9,
        12
      ],
      "actual_euro": [
        1,
        12
      ],
      "euro_matches": 1,
      "gewinnklasse": null,
      "method": "ensemble_champion",
      "provider": "ensemble",
      "confidence": 90,
      "strategy": "Gewichtetes Voting aus 21 KI-Vorhersagen"
    },
    {
      "id": "ej_28.12.2025_ml_bayesian_real_1766893783.73317",
      "date": "2025-12-28T03:49:43.733172",
      "draw_date": "28.12.2025",
      "predicted_numbers": [
        38,
        22,
        25,
        26,
        29
      ],
      "actual_numbers": [
        2,
        4,
        11,
        48,
        31
      ],
      "main_matches": 0,
      "predicted_euro": [
        1,
        2
      ],
      "actual_euro": [
        1,
        12
      ],
      "euro_matches": 1,
      "gewinnklasse": null,
      "method": "ml_bayesian_real",
      "provider": "ml_real",
      "confidence": 75,
      "strategy": "Echtes ML: bayesian"
    },
    {
      "id": "ej_28.12.2025_ml_reinforcement_real_1766893783.733191",
      "date": "2025-12-28T03:49:43.733195",
      "draw_date": "28.12.2025",
      "predicted_numbers": [
        21,
        24,
        25,
        28,
        29
      ],
      "actual_numbers": [
        2,
        4,
        11,
        48,
        31
      ],
      "main_matches": 0,
      "predicted_euro": [
        9,
        12
      ],
      "actual_euro": [
        1,
        12
      ],
      "euro_matches": 1,
      "gewinnklasse": null,
      "method": "ml_reinforcement_real",
      "provider": "ml_real",
      "confidence": 75,
      "strategy": "Beste Strategie: ml_ensemble"
    },
    {
      "id": "ej_28.12.2025_ml_markov_real_1766893783.733214",
      "date": "2025-12-28T03:49:43.733216",
      "draw_date": "28.12.2025",
      "predicted_numbers": [
        11,
        18,
        21,
        25,
        29
      ],
      "actual_numbers": [
        2,
        4,
        11,
        48,
        31
      ],
      "main_matches": 1,
      "predicted_euro": [
        12,
        6
      ],
      "actual_euro": [
        1,
        12
      ],
      "euro_matches": 1,
      "gewinnklasse": null,
      "method": "ml_markov_real",
      "provider": "ml_real",
      "confidence": 29.45355316994677,
      "strategy": "Echtes ML: markov"
    },
    {
      "id": "ej_28.12.2025_ml_eurozahl_real_1766893783.733231",
      "date": "2025-12-28T03:49:43.733233",
      "draw_date": "28.12.2025",
      "predicted_numbers": [
        21,
        24,
        25,
        28,
        29
      ],
      "actual_numbers": [
        2,
        4,
        11,
        48,
        31
      ],
      "main_matches": 0,
      "predicted_euro": [
        9,
        12
      ],
      "actual_euro": [
        1,
        12
      ],
      "euro_matches": 1,
      "gewinnklasse": null,
      "method": "ml_eurozahl_real",
      "provider": "ml_real",
      "confidence": 10.487621864069341,
      "strategy": "Spezialisiertes ML f\u00fcr 2 aus 12 mit Paar-Analyse"
    },
    {
      "id": "ej_28.12.2025_ml_neural_network_real_1766893783.733248",
      "date": "2025-12-28T03:49:43.733250",
      "draw_date": "28.12.2025",
      "predicted_numbers": [
        36,
        42,
        21,
        24,
        28
      ],
      "actual_numbers": [
        2,
        4,
        11,
        48,
        31
      ],
      "main_matches": 0,
      "predicted_euro": [
        8,
        9
      ],
      "actual_euro": [
        1,
        12
      ],
      "euro_matches": 0,
      "gewinnklasse": null,
      "method": "ml_neural_network_real",
      "provider": "ml_real",
      "confidence": 3.3689727100937352,
      "strategy": "Echtes ML: neural_network"
    },
    {
      "id": "ej_28.12.2025_ej_odd_even_32_1766893783.733279",
      "date": "2025-12-28T03:49:43.733282",
      "draw_date": "28.12.2025",
      "predicted_numbers": [
        38,
        41,
        10,
        21,
        31
      ],
      "actual_numbers": [
        2,
        4,
        11,
        48,
        31
      ],
      "main_matches": 1,
      "predicted_euro": [
        5,
        6
      ],
      "actual_euro": [
        1,
        12
      ],
      "euro_matches": 0,
      "gewinnklasse": null,
      "method": "ej_odd_even_32",
      "provider": "local_ml",
      "confidence": 78.3,
      "strategy": "Optimale Gerade/Ungerade-Balance"
    },
    {
      "id": "ej_02.01.2026_ml_ensemble_real_1767385178.444777",
      "date": "2026-01-02T20:19:38.444790",
      "draw_date": "02.01.2026",
      "predicted_numbers": [
        5,
        9,
        13,
        25,
        29
      ],
      "actual_numbers": [
        4,
        43,
        12,
        17,
        31
      ],
      "main_matches": 0,
      "predicted_euro": [
        9,
        2
      ],
      "actual_euro": [
        10,
        3
      ],
      "euro_matches": 0,
      "gewinnklasse": null,
      "method": "ml_ensemble_real",
      "provider": "ml_real",
      "confidence": 88,
      "strategy": "Gewichtetes Voting aus Neural Network, Markov, Bayesian & EurozahlML"
    },
    {
      "id": "ej_02.01.2026_ensemble_champion_1767385178.444823",
      "date": "2026-01-02T20:19:38.444825",
      "draw_date": "02.01.2026",
      "predicted_numbers": [
        5,
        9,
        13,
        25,
        29
      ],
      "actual_numbers": [
        4,
        43,
        12,
        17,
        31
      ],
      "main_matches": 0,
      "predicted_euro": [
        9,
        2
      ],
      "actual_euro": [
        10,
        3
      ],
      "euro_matches": 0,
      "gewinnklasse": null,
      "method": "ensemble_champion",
      "provider": "ensemble",
      "confidence": 90,
      "strategy": "Gewichtetes Voting aus 21 KI-Vorhersagen"
    },
    {
      "id": "ej_02.01.2026_ml_bayesian_real_1767385178.444844",
      "date": "2026-01-02T20:19:38.444846",
      "draw_date": "02.01.2026",
      "predicted_numbers": [
        44,
        21,
        22,
        25,
        29
      ],
      "actual_numbers": [
        4,
        43,
        12,
        17,
        31
      ],
      "main_matches": 0,
      "predicted_euro": [
        1,
        2
      ],
      "actual_euro": [
        10,
        3
      ],
      "euro_matches": 0,
      "gewinnklasse": null,
      "method": "ml_bayesian_real",
      "provider": "ml_real",
      "confidence": 75,
      "strategy": "Echtes ML: bayesian"
    },
    {
      "id": "ej_02.01.2026_ml_reinforcement_real_1767385178.444862",
      "date": "2026-01-02T20:19:38.444864",
      "draw_date": "02.01.2026",
      "predicted_numbers": [
        5,
        9,
        13,
        25,
        29
      ],
      "actual_numbers": [
        4,
        43,
        12,
        17,
        31
      ],
      "main_matches": 0,
      "predicted_euro": [
        9,
        2
      ],
      "actual_euro": [
        10,
        3
      ],
      "euro_matches": 0,
      "gewinnklasse": null,
      "method": "ml_reinforcement_real",
      "provider": "ml_real",
      "confidence": 75,
      "strategy": "Beste Strategie: ml_ensemble"
    },
    {
      "id": "ej_02.01.2026_ml_markov_real_1767385178.444881",
      "date": "2026-01-02T20:19:38.444883",
      "draw_date": "02.01.2026",
      "predicted_numbers": [
        45,
        50,
        25,
        26,
        29
      ],
      "actual_numbers": [
        4,
        43,
        12,
        17,
        31
      ],
      "main_matches": 0,
      "predicted_euro": [
        8,
        2
      ],
      "actual_euro": [
        10,
        3
      ],
      "euro_matches": 0,
      "gewinnklasse": null,
      "method": "ml_markov_real",
      "provider": "ml_real",
      "confidence": 29.98083777974749,
      "strategy": "Echtes ML: markov"
    },
    {
      "id": "ej_02.01.2026_ml_eurozahl_real_1767385178.444898",
      "date": "2026-01-02T20:19:38.444900",
      "draw_date": "02.01.2026",
      "predicted_numbers": [
        5,
        9,
        13,
        25,
        29
      ],
      "actual_numbers": [
        4,
        43,
        12,
        17,
        31
      ],
      "main_matches": 0,
      "predicted_euro": [
        9,
        11
      ],
      "actual_euro": [
        10,
        3
      ],
      "euro_matches": 0,
      "gewinnklasse": null,
      "method": "ml_eurozahl_real",
      "provider": "ml_real",
      "confidence": 9.56939528341197,
      "strategy": "Spezialisiertes ML f\u00fcr 2 aus 12 mit Paar-Analyse"
    },
    {
      "id": "ej_02.01.2026_ml_neural_network_real_1767385178.444918",
      "date": "2026-01-02T20:19:38.444920",
      "draw_date": "02.01.2026",
      "predicted_numbers": [
        5,
        9,
        42,
        13,
        18
      ],
      "actual_numbers": [
        4,
        43,
        12,
        17,
        31
      ],
      "main_matches": 0,
      "predicted_euro": [
        9,
        10
      ],
      "actual_euro": [
        10,
        3
      ],
      "euro_matches": 1,
      "gewinnklasse": null,
      "method": "ml_neural_network_real",
      "provider": "ml_real",
      "confidence": 3.775399316594753,
      "strategy": "Echtes ML: neural_network"
    },
    {
      "id": "ej_02.01.2026_ej_prime_mix_1767385178.44495",
      "date": "2026-01-02T20:19:38.444952",
      "draw_date": "02.01.2026",
      "predicted_numbers": [
        1,
        43,
        50,
        26,
        29
      ],
      "actual_numbers": [
        4,
        43,
        12,
        17,
        31
      ],
      "main_matches": 1,
      "predicted_euro": [
        1,
        9
      ],
      "actual_euro": [
        10,
        3
      ],
      "euro_matches": 0,
      "gewinnklasse": null,
      "method": "ej_prime_mix",
      "provider": "local_ml",
      "confidence": 78.0,
      "strategy": "2 Primzahlen + 3 andere"
    },
    {
      "id": "ej_03.01.2026_ml_ensemble_real_1767471377.781388",
      "date": "2026-01-03T20:16:17.781399",
      "draw_date": "03.01.2026",
      "predicted_numbers": [
        9,
        45,
        21,
        24,
        28
      ],
      "actual_numbers": [
        35,
        6,
        18,
        20,
        31
      ],
      "main_matches": 0,
      "predicted_euro": [
        8,
        2
      ],
      "actual_euro": [
        1,
        4
      ],
      "euro_matches": 0,
      "gewinnklasse": null,
      "method": "ml_ensemble_real",
      "provider": "ml_real",
      "confidence": 88,
      "strategy": "Gewichtetes Voting aus Neural Network, Markov, Bayesian & EurozahlML"
    },
    {
      "id": "ej_03.01.2026_ensemble_champion_1767471377.781433",
      "date": "2026-01-03T20:16:17.781436",
      "draw_date": "03.01.2026",
      "predicted_numbers": [
        9,
        45,
        21,
        24,
        28
      ],
      "actual_numbers": [
        35,
        6,
        18,
        20,
        31
      ],
      "main_matches": 0,
      "predicted_euro": [
        2,
        7
      ],
      "actual_euro": [
        1,
        4
      ],
      "euro_matches": 0,
      "gewinnklasse": null,
      "method": "ensemble_champion",
      "provider": "ensemble",
      "confidence": 90,
      "strategy": "Gewichtetes Voting aus 21 KI-Vorhersagen"
    },
    {
      "id": "ej_03.01.2026_ml_bayesian_real_1767471377.781456",
      "date": "2026-01-03T20:16:17.781459",
      "draw_date": "03.01.2026",
      "predicted_numbers": [
        45,
        21,
        22,
        24,
        25
      ],
      "actual_numbers": [
        35,
        6,
        18,
        20,
        31
      ],
      "main_matches": 0,
      "predicted_euro": [
        2,
        6
      ],
      "actual_euro": [
        1,
        4
      ],
      "euro_matches": 0,
      "gewinnklasse": null,
      "method": "ml_bayesian_real",
      "provider": "ml_real",
      "confidence": 75,
      "strategy": "Echtes ML: bayesian"
    },
    {
      "id": "ej_03.01.2026_ml_reinforcement_real_1767471377.781475",
      "date": "2026-01-03T20:16:17.781477",
      "draw_date": "03.01.2026",
      "predicted_numbers": [
        9,
        45,
        21,
        24,
        28
      ],
      "actual_numbers": [
        35,
        6,
        18,
        20,
        31
      ],
      "main_matches": 0,
      "predicted_euro": [
        8,
        2
      ],
      "actual_euro": [
        1,
        4
      ],
      "euro_matches": 0,
      "gewinnklasse": null,
      "method": "ml_reinforcement_real",
      "provider": "ml_real",
      "confidence": 75,
      "strategy": "Beste Strategie: ml_ensemble"
    },
    {
      "id": "ej_03.01.2026_ml_markov_real_1767471377.781492",
      "date": "2026-01-03T20:16:17.781494",
      "draw_date": "03.01.2026",
      "predicted_numbers": [
        34,
        11,
        45,
        50,
        30
      ],
      "actual_numbers": [
        35,
        6,
        18,
        20,
        31
      ],
      "main_matches": 0,
      "predicted_euro": [
        2,
        12
      ],
      "actual_euro": [
        1,
        4
      ],
      "euro_matches": 0,
      "gewinnklasse": null,
      "method": "ml_markov_real",
      "provider": "ml_real",
      "confidence": 30.3668521307551,
      "strategy": "Echtes ML: markov"
    },
    {
      "id": "ej_03.01.2026_ml_eurozahl_real_1767471377.781511",
      "date": "2026-01-03T20:16:17.781513",
      "draw_date": "03.01.2026",
      "predicted_numbers": [
        9,
        45,
        21,
        24,
        28
      ],
      "actual_numbers": [
        35,
        6,
        18,
        20,
        31
      ],
      "main_matches": 0,
      "predicted_euro": [
        8,
        5
      ],
      "actual_euro": [
        1,
        4
      ],
      "euro_matches": 0,
      "gewinnklasse": null,
      "method": "ml_eurozahl_real",
      "provider": "ml_real",
      "confidence": 9.7579525480686,
      "strategy": "Spezialisiertes ML f\u00fcr 2 aus 12 mit Paar-Analyse"
    },
    {
      "id": "ej_03.01.2026_ml_neural_network_real_1767471377.78153",
      "date": "2026-01-03T20:16:17.781532",
      "draw_date": "03.01.2026",
      "predicted_numbers": [
        36,
        9,
        21,
        24,
        28
      ],
      "actual_numbers": [
        35,
        6,
        18,
        20,
        31
      ],
      "main_matches": 0,
      "predicted_euro": [
        8,
        9
      ],
      "actual_euro": [
        1,
        4
      ],
      "euro_matches": 0,
      "gewinnklasse": null,
      "method": "ml_neural_network_real",
      "provider": "ml_real",
      "confidence": 3.7758823888412154,
      "strategy": "Echtes ML: neural_network"
    },
    {
      "id": "ej_03.01.2026_ej_odd_even_23_1767471377.781562",
      "date": "2026-01-03T20:16:17.781565",
      "draw_date": "03.01.2026",
      "predicted_numbers": [
        33,
        12,
        14,
        22,
        31
      ],
      "actual_numbers": [
        35,
        6,
        18,
        20,
        31
      ],
      "main_matches": 1,
      "predicted_euro": [
        2,
        7
      ],
      "actual_euro": [
        1,
        4
      ],
      "euro_matches": 0,
      "gewinnklasse": null,
      "method": "ej_odd_even_23",
      "provider": "local_ml",
      "confidence": 77.9,
      "strategy": "Alternative Gerade/Ungerade-Balance"
    },
    {
      "id": "ej_04.01.2026_ml_ensemble_real_1767498785.625666",
      "date": "2026-01-04T03:53:05.625675",
      "draw_date": "04.01.2026",
      "predicted_numbers": [
        34,
        9,
        11,
        50,
        21
      ],
      "actual_numbers": [
        14,
        18,
        25,
        26,
        28
      ],
      "main_matches": 0,
      "predicted_euro": [
        2,
        10
      ],
      "actual_euro": [
        2,
        3
      ],
      "euro_matches": 1,
      "gewinnklasse": null,
      "method": "ml_ensemble_real",
      "provider": "ml_real",
      "confidence": 88,
      "strategy": "Gewichtetes Voting aus Neural Network, Markov, Bayesian & EurozahlML"
    },
    {
      "id": "ej_04.01.2026_ensemble_champion_1767498785.625705",
      "date": "2026-01-04T03:53:05.625707",
      "draw_date": "04.01.2026",
      "predicted_numbers": [
        34,
        9,
        21,
        25,
        28
      ],
      "actual_numbers": [
        14,
        18,
        25,
        26,
        28
      ],
      "main_matches": 2,
      "predicted_euro": [
        2,
        10
      ],
      "actual_euro": [
        2,
        3
      ],
      "euro_matches": 1,
      "gewinnklasse": 12,
      "method": "ensemble_champion",
      "provider": "ensemble",
      "confidence": 90,
      "strategy": "Gewichtetes Voting aus 21 KI-Vorhersagen"
    },
    {
      "id": "ej_04.01.2026_ml_bayesian_real_1767498785.625731",
      "date": "2026-01-04T03:53:05.625733",
      "draw_date": "04.01.2026",
      "predicted_numbers": [
        34,
        50,
        21,
        23,
        25
      ],
      "actual_numbers": [
        14,
        18,
        25,
        26,
        28
      ],
      "main_matches": 1,
      "predicted_euro": [
        1,
        2
      ],
      "actual_euro": [
        2,
        3
      ],
      "euro_matches": 1,
      "gewinnklasse": null,
      "method": "ml_bayesian_real",
      "provider": "ml_real",
      "confidence": 75,
      "strategy": "Echtes ML: bayesian"
    },
    {
      "id": "ej_04.01.2026_ml_reinforcement_real_1767498785.62575",
      "date": "2026-01-04T03:53:05.625752",
      "draw_date": "04.01.2026",
      "predicted_numbers": [
        34,
        9,
        11,
        50,
        21
      ],
      "actual_numbers": [
        14,
        18,
        25,
        26,
        28
      ],
      "main_matches": 0,
      "predicted_euro": [
        2,
        10
      ],
      "actual_euro": [
        2,
        3
      ],
      "euro_matches": 1,
      "gewinnklasse": null,
      "method": "ml_reinforcement_real",
      "provider": "ml_real",
      "confidence": 75,
      "strategy": "Beste Strategie: ml_ensemble"
    },
    {
      "id": "ej_04.01.2026_ml_markov_real_1767498785.625767",
      "date": "2026-01-04T03:53:05.625769",
      "draw_date": "04.01.2026",
      "predicted_numbers": [
        34,
        45,
        50,
        21,
        22
      ],
      "actual_numbers": [
        14,
        18,
        25,
        26,
        28
      ],
      "main_matches": 0,
      "predicted_euro": [
        2,
        3
      ],
      "actual_euro": [
        2,
        3
      ],
      "euro_matches": 2,
      "gewinnklasse": null,
      "method": "ml_markov_real",
      "provider": "ml_real",
      "confidence": 30.66916727113005,
      "strategy": "Echtes ML: markov"
    },
    {
      "id": "ej_04.01.2026_ml_eurozahl_real_1767498785.625786",
      "date": "2026-01-04T03:53:05.625788",
      "draw_date": "04.01.2026",
      "predicted_numbers": [
        34,
        9,
        11,
        50,
        21
      ],
      "actual_numbers": [
        14,
        18,
        25,
        26,
        28
      ],
      "main_matches": 0,
      "predicted_euro": [
        10,
        12
      ],
      "actual_euro": [
        2,
        3
      ],
      "euro_matches": 0,
      "gewinnklasse": null,
      "method": "ml_eurozahl_real",
      "provider": "ml_real",
      "confidence": 10.401084294885596,
      "strategy": "Spezialisiertes ML f\u00fcr 2 aus 12 mit Paar-Analyse"
    },
    {
      "id": "ej_04.01.2026_ml_neural_network_real_1767498785.625806",
      "date": "2026-01-04T03:53:05.625808",
      "draw_date": "04.01.2026",
      "predicted_numbers": [
        40,
        9,
        11,
        13,
        28
      ],
      "actual_numbers": [
        14,
        18,
        25,
        26,
        28
      ],
      "main_matches": 1,
      "predicted_euro": [
        9,
        6
      ],
      "actual_euro": [
        2,
        3
      ],
      "euro_matches": 0,
      "gewinnklasse": null,
      "method": "ml_neural_network_real",
      "provider": "ml_real",
      "confidence": 3.6608472188859027,
      "strategy": "Echtes ML: neural_network"
    },
    {
      "id": "ej_04.01.2026_ej_cold_1767498785.625838",
      "date": "2026-01-04T03:53:05.625840",
      "draw_date": "04.01.2026",
      "predicted_numbers": [
        34,
        42,
        15,
        18,
        21
      ],
      "actual_numbers": [
        14,
        18,
        25,
        26,
        28
      ],
      "main_matches": 1,
      "predicted_euro": [
        11,
        12
      ],
      "actual_euro": [
        2,
        3
      ],
      "euro_matches": 0,
      "gewinnklasse": null,
      "method": "ej_cold",
      "provider": "local_ml",
      "confidence": 77.6,
      "strategy": "Seltener gezogene Zahlen"
    },
    {
      "id": "ej_06.01.2026_ml_ensemble_real_1767730804.579394",
      "date": "2026-01-06T20:20:04.579406",
      "draw_date": "06.01.2026",
      "predicted_numbers": [
        38,
        10,
        11,
        50,
        22
      ],
      "actual_numbers": [
        4,
        5,
        42,
        45,
        20
      ],
      "main_matches": 0,
      "predicted_euro": [
        12,
        5
      ],
      "actual_euro": [
        4,
        7
      ],
      "euro_matches": 0,
      "gewinnklasse": null,
      "method": "ml_ensemble_real",
      "provider": "ml_real",
      "confidence": 88,
      "strategy": "Gewichtetes Voting aus Neural Network, Markov, Bayesian & EurozahlML"
    },
    {
      "id": "ej_06.01.2026_ensemble_champion_1767730804.579439",
      "date": "2026-01-06T20:20:04.579441",
      "draw_date": "06.01.2026",
      "predicted_numbers": [
        4,
        38,
        11,
        16,
        22
      ],
      "actual_numbers": [
        4,
        5,
        42,
        45,
        20
      ],
      "main_matches": 1,
      "predicted_euro": [
        12,
        5
      ],
      "actual_euro": [
        4,
        7
      ],
      "euro_matches": 0,
      "gewinnklasse": null,
      "method": "ensemble_champion",
      "provider": "ensemble",
      "confidence": 90,
      "strategy": "Gewichtetes Voting aus 21 KI-Vorhersagen"
    },
    {
      "id": "ej_06.01.2026_ml_bayesian_real_1767730804.579463",
      "date": "2026-01-06T20:20:04.579465",
      "draw_date": "06.01.2026",
      "predicted_numbers": [
        34,
        38,
        45,
        50,
        22
      ],
      "actual_numbers": [
        4,
        5,
        42,
        45,
        20
      ],
      "main_matches": 1,
      "predicted_euro": [
        2,
        12
      ],
      "actual_euro": [
        4,
        7
      ],
      "euro_matches": 0,
      "gewinnklasse": null,
      "method": "ml_bayesian_real",
      "provider": "ml_real",
      "confidence": 75,
      "strategy": "Echtes ML: bayesian"
    },
    {
      "id": "ej_06.01.2026_ml_reinforcement_real_1767730804.57948",
      "date": "2026-01-06T20:20:04.579482",
      "draw_date": "06.01.2026",
      "predicted_numbers": [
        38,
        10,
        11,
        50,
        22
      ],
      "actual_numbers": [
        4,
        5,
        42,
        45,
        20
      ],
      "main_matches": 0,
      "predicted_euro": [
        12,
        5
      ],
      "actual_euro": [
        4,
        7
      ],
      "euro_matches": 0,
      "gewinnklasse": null,
      "method": "ml_reinforcement_real",
      "provider": "ml_real",
      "confidence": 75,
      "strategy": "Beste Strategie: ml_ensemble"
    },
    {
      "id": "ej_06.01.2026_ml_markov_real_1767730804.579497",
      "date": "2026-01-06T20:20:04.579499",
      "draw_date": "06.01.2026",
      "predicted_numbers": [
        38,
        39,
        50,
        21,
        22
      ],
      "actual_numbers": [
        4,
        5,
        42,
        45,
        20
      ],
      "main_matches": 0,
      "predicted_euro": [
        12,
        5
      ],
      "actual_euro": [
        4,
        7
      ],
      "euro_matches": 0,
      "gewinnklasse": null,
      "method": "ml_markov_real",
      "provider": "ml_real",
      "confidence": 29.15093518650618,
      "strategy": "Echtes ML: markov"
    },
    {
      "id": "ej_06.01.2026_ml_eurozahl_real_1767730804.579517",
      "date": "2026-01-06T20:20:04.579519",
      "draw_date": "06.01.2026",
      "predicted_numbers": [
        38,
        10,
        11,
        50,
        22
      ],
      "actual_numbers": [
        4,
        5,
        42,
        45,
        20
      ],
      "main_matches": 0,
      "predicted_euro": [
        3,
        5
      ],
      "actual_euro": [
        4,
        7
      ],
      "euro_matches": 0,
      "gewinnklasse": null,
      "method": "ml_eurozahl_real",
      "provider": "ml_real",
      "confidence": 9.97176124402227,
      "strategy": "Spezialisiertes ML f\u00fcr 2 aus 12 mit Paar-Analyse"
    },
    {
      "id": "ej_06.01.2026_ml_neural_network_real_1767730804.579566",
      "date": "2026-01-06T20:20:04.579569",
      "draw_date": "06.01.2026",
      "predicted_numbers": [
        10,
        11,
        13,
        20,
        25
      ],
      "actual_numbers": [
        4,
        5,
        42,
        45,
        20
      ],
      "main_matches": 1,
      "predicted_euro": [
        8,
        9
      ],
      "actual_euro": [
        4,
        7
      ],
      "euro_matches": 0,
      "gewinnklasse": null,
      "method": "ml_neural_network_real",
      "provider": "ml_real",
      "confidence": 3.1013988782774633,
      "strategy": "Echtes ML: neural_network"
    },
    {
      "id": "ej_06.01.2026_ej_sum_optimized_1767730804.579602",
      "date": "2026-01-06T20:20:04.579604",
      "draw_date": "06.01.2026",
      "predicted_numbers": [
        4,
        12,
        47,
        16,
        31
      ],
      "actual_numbers": [
        4,
        5,
        42,
        45,
        20
      ],
      "main_matches": 1,
      "predicted_euro": [
        8,
        10
      ],
      "actual_euro": [
        4,
        7
      ],
      "euro_matches": 0,
      "gewinnklasse": null,
      "method": "ej_sum_optimized",
      "provider": "local_ml",
      "confidence": 77.6,
      "strategy": "Optimiert auf typische Summen"
    },
    {
      "id": "ej_07.01.2026_ml_ensemble_real_1767813864.000712",
      "date": "2026-01-07T19:24:24.000725",
      "draw_date": "07.01.2026",
      "predicted_numbers": [
        12,
        13,
        44,
        50,
        22
      ],
      "actual_numbers": [
        34,
        6,
        16,
        25,
        28
      ],
      "main_matches": 0,
      "predicted_euro": [
        9,
        2
      ],
      "actual_euro": [
        8,
        2
      ],
      "euro_matches": 1,
      "gewinnklasse": null,
      "method": "ml_ensemble_real",
      "provider": "ml_real",
      "confidence": 88,
      "strategy": "Gewichtetes Voting aus Neural Network, Markov, Bayesian & EurozahlML"
    },
    {
      "id": "ej_07.01.2026_ensemble_champion_1767813864.00076",
      "date": "2026-01-07T19:24:24.000763",
      "draw_date": "07.01.2026",
      "predicted_numbers": [
        35,
        12,
        44,
        50,
        22
      ],
      "actual_numbers": [
        34,
        6,
        16,
        25,
        28
      ],
      "main_matches": 0,
      "predicted_euro": [
        9,
        2
      ],
      "actual_euro": [
        8,
        2
      ],
      "euro_matches": 1,
      "gewinnklasse": null,
      "method": "ensemble_champion",
      "provider": "ensemble",
      "confidence": 90,
      "strategy": "Gewichtetes Voting aus 21 KI-Vorhersagen"
    },
    {
      "id": "ej_07.01.2026_ml_bayesian_real_1767813864.000781",
      "date": "2026-01-07T19:24:24.000783",
      "draw_date": "07.01.2026",
      "predicted_numbers": [
        12,
        45,
        44,
        50,
        22
      ],
      "actual_numbers": [
        34,
        6,
        16,
        25,
        28
      ],
      "main_matches": 0,
      "predicted_euro": [
        2,
        3
      ],
      "actual_euro": [
        8,
        2
      ],
      "euro_matches": 1,
      "gewinnklasse": null,
      "method": "ml_bayesian_real",
      "provider": "ml_real",
      "confidence": 75,
      "strategy": "Echtes ML: bayesian"
    },
    {
      "id": "ej_07.01.2026_ml_reinforcement_real_1767813864.000805",
      "date": "2026-01-07T19:24:24.000807",
      "draw_date": "07.01.2026",
      "predicted_numbers": [
        12,
        13,
        44,
        50,
        22
      ],
      "actual_numbers": [
        34,
        6,
        16,
        25,
        28
      ],
      "main_matches": 0,
      "predicted_euro": [
        9,
        2
      ],
      "actual_euro": [
        8,
        2
      ],
      "euro_matches": 1,
      "gewinnklasse": null,
      "method": "ml_reinforcement_real",
      "provider": "ml_real",
      "confidence": 75,
      "strategy": "Beste Strategie: ml_ensemble"
    },
    {
      "id": "ej_07.01.2026_ml_markov_real_1767813864.000825",
      "date": "2026-01-07T19:24:24.000827",
      "draw_date": "07.01.2026",
      "predicted_numbers": [
        34,
        38,
        44,
        50,
        22
      ],
      "actual_numbers": [
        34,
        6,
        16,
        25,
        28
      ],
      "main_matches": 1,
      "predicted_euro": [
        1,
        9
      ],
      "actual_euro": [
        8,
        2
      ],
      "euro_matches": 0,
      "gewinnklasse": null,
      "method": "ml_markov_real",
      "provider": "ml_real",
      "confidence": 29.39030496593354,
      "strategy": "Echtes ML: markov"
    },
    {
      "id": "ej_07.01.2026_ml_eurozahl_real_1767813864.000843",
      "date": "2026-01-07T19:24:24.000845",
      "draw_date": "07.01.2026",
      "predicted_numbers": [
        12,
        13,
        44,
        50,
        22
      ],
      "actual_numbers": [
        34,
        6,
        16,
        25,
        28
      ],
      "main_matches": 0,
      "predicted_euro": [
        2,
        4
      ],
      "actual_euro": [
        8,
        2
      ],
      "euro_matches": 1,
      "gewinnklasse": null,
      "method": "ml_eurozahl_real",
      "provider": "ml_real",
      "confidence": 10.184252425112842,
      "strategy": "Spezialisiertes ML f\u00fcr 2 aus 12 mit Paar-Analyse"
    },
    {
      "id": "ej_07.01.2026_ml_neural_network_real_1767813864.00086",
      "date": "2026-01-07T19:24:24.000862",
      "draw_date": "07.01.2026",
      "predicted_numbers": [
        35,
        12,
        13,
        49,
        22
      ],
      "actual_numbers": [
        34,
        6,
        16,
        25,
        28
      ],
      "main_matches": 0,
      "predicted_euro": [
        8,
        9
      ],
      "actual_euro": [
        8,
        2
      ],
      "euro_matches": 1,
      "gewinnklasse": null,
      "method": "ml_neural_network_real",
      "provider": "ml_real",
      "confidence": 3.414582901658931,
      "strategy": "Echtes ML: neural_network"
    },
    {
      "id": "ej_07.01.2026_ej_overdue_1767813864.000893",
      "date": "2026-01-07T19:24:24.000895",
      "draw_date": "07.01.2026",
      "predicted_numbers": [
        35,
        36,
        44,
        21,
        26
      ],
      "actual_numbers": [
        34,
        6,
        16,
        25,
        28
      ],
      "main_matches": 0,
      "predicted_euro": [
        3,
        12
      ],
      "actual_euro": [
        8,
        2
      ],
      "euro_matches": 0,
      "gewinnklasse": null,
      "method": "ej_overdue",
      "provider": "local_ml",
      "confidence": 77.0,
      "strategy": "Zahlen die lange nicht kamen"
    },
    {
      "id": "ej_09.01.2026_ml_ensemble_real_1767990063.074384",
      "date": "2026-01-09T20:21:03.074393",
      "draw_date": "09.01.2026",
      "predicted_numbers": [
        35,
        13,
        18,
        22,
        25
      ],
      "actual_numbers": [
        35,
        38,
        42,
        20,
        25
      ],
      "main_matches": 2,
      "predicted_euro": [
        8,
        11
      ],
      "actual_euro": [
        11,
        5
      ],
      "euro_matches": 1,
      "gewinnklasse": 12,
      "method": "ml_ensemble_real",
      "provider": "ml_real",
      "confidence": 88,
      "strategy": "Gewichtetes Voting aus Neural Network, Markov, Bayesian & EurozahlML"
    },
    {
      "id": "ej_09.01.2026_ensemble_champion_1767990063.074427",
      "date": "2026-01-09T20:21:03.074429",
      "draw_date": "09.01.2026",
      "predicted_numbers": [
        47,
        18,
        22,
        24,
        25
      ],
      "actual_numbers": [
        35,
        38,
        42,
        20,
        25
      ],
      "main_matches": 1,
      "predicted_euro": [
        8,
        3
      ],
      "actual_euro": [
        11,
        5
      ],
      "euro_matches": 0,
      "gewinnklasse": null,
      "method": "ensemble_champion",
      "provider": "ensemble",
      "confidence": 90,
      "strategy": "Gewichtetes Voting aus 21 KI-Vorhersagen"
    },
    {
      "id": "ej_09.01.2026_ml_bayesian_real_1767990063.074449",
      "date": "2026-01-09T20:21:03.074451",
      "draw_date": "09.01.2026",
      "predicted_numbers": [
        33,
        18,
        22,
        25,
        29
      ],
      "actual_numbers": [
        35,
        38,
        42,
        20,
        25
      ],
      "main_matches": 1,
      "predicted_euro": [
        9,
        2
      ],
      "actual_euro": [
        11,
        5
      ],
      "euro_matches": 0,
      "gewinnklasse": null,
      "method": "ml_bayesian_real",
      "provider": "ml_real",
      "confidence": 75,
      "strategy": "Echtes ML: bayesian"
    },
    {
      "id": "ej_09.01.2026_ml_reinforcement_real_1767990063.074468",
      "date": "2026-01-09T20:21:03.074470",
      "draw_date": "09.01.2026",
      "predicted_numbers": [
        35,
        13,
        18,
        22,
        25
      ],
      "actual_numbers": [
        35,
        38,
        42,
        20,
        25
      ],
      "main_matches": 2,
      "predicted_euro": [
        8,
        11
      ],
      "actual_euro": [
        11,
        5
      ],
      "euro_matches": 1,
      "gewinnklasse": 12,
      "method": "ml_reinforcement_real",
      "provider": "ml_real",
      "confidence": 75,
      "strategy": "Beste Strategie: ml_ensemble"
    },
    {
      "id": "ej_09.01.2026_ml_markov_real_1767990063.074491",
      "date": "2026-01-09T20:21:03.074493",
      "draw_date": "09.01.2026",
      "predicted_numbers": [
        45,
        18,
        50,
        21,
        22
      ],
      "actual_numbers": [
        35,
        38,
        42,
        20,
        25
      ],
      "main_matches": 0,
      "predicted_euro": [
        11,
        3
      ],
      "actual_euro": [
        11,
        5
      ],
      "euro_matches": 1,
      "gewinnklasse": null,
      "method": "ml_markov_real",
      "provider": "ml_real",
      "confidence": 28.998473297827854,
      "strategy": "Echtes ML: markov"
    },
    {
      "id": "ej_09.01.2026_ml_eurozahl_real_1767990063.074509",
      "date": "2026-01-09T20:21:03.074511",
      "draw_date": "09.01.2026",
      "predicted_numbers": [
        35,
        13,
        18,
        22,
        25
      ],
      "actual_numbers": [
        35,
        38,
        42,
        20,
        25
      ],
      "main_matches": 2,
      "predicted_euro": [
        8,
        11
      ],
      "actual_euro": [
        11,
        5
      ],
      "euro_matches": 1,
      "gewinnklasse": 12,
      "method": "ml_eurozahl_real",
      "provider": "ml_real",
      "confidence": 9.810595973414129,
      "strategy": "Spezialisiertes ML f\u00fcr 2 aus 12 mit Paar-Analyse"
    },
    {
      "id": "ej_09.01.2026_ml_neural_network_real_1767990063.074529",
      "date": "2026-01-09T20:21:03.074531",
      "draw_date": "09.01.2026",
      "predicted_numbers": [
        35,
        40,
        13,
        18,
        25
      ],
      "actual_numbers": [
        35,
        38,
        42,
        20,
        25
      ],
      "main_matches": 2,
      "predicted_euro": [
        8,
        9
      ],
      "actual_euro": [
        11,
        5
      ],
      "euro_matches": 0,
      "gewinnklasse": null,
      "method": "ml_neural_network_real",
      "provider": "ml_real",
      "confidence": 3.3461695705602237,
      "strategy": "Echtes ML: neural_network"
    },
    {
      "id": "ej_09.01.2026_ej_delta_1767990063.074561",
      "date": "2026-01-09T20:21:03.074563",
      "draw_date": "09.01.2026",
      "predicted_numbers": [
        3,
        4,
        11,
        14,
        23
      ],
      "actual_numbers": [
        35,
        38,
        42,
        20,
        25
      ],
      "main_matches": 0,
      "predicted_euro": [
        1,
        5
      ],
      "actual_euro": [
        11,
        5
      ],
      "euro_matches": 1,
      "gewinnklasse": null,
      "method": "ej_delta",
      "provider": "local_ml",
      "confidence": 77.0,
      "strategy": "Basiert auf typischen Abst\u00e4nden"
    },
    {
      "id": "ej_14.01.2026_ml_ensemble_real_1768403410.537396",
      "date": "2026-01-14T15:10:10.537413",
      "draw_date": "14.01.2026",
      "predicted_numbers": [
        45,
        18,
        21,
        24,
        28
      ],
      "actual_numbers": [
        9,
        41,
        13,
        25,
        31
      ],
      "main_matches": 0,
      "predicted_euro": [
        2,
        10
      ],
      "actual_euro": [
        10,
        5
      ],
      "euro_matches": 1,
      "gewinnklasse": null,
      "method": "ml_ensemble_real",
      "provider": "ml_real",
      "confidence": 88,
      "strategy": "Gewichtetes Voting aus Neural Network, Markov, Bayesian & EurozahlML"
    },
    {
      "id": "ej_14.01.2026_ensemble_champion_1768403410.537465",
      "date": "2026-01-14T15:10:10.537467",
      "draw_date": "14.01.2026",
      "predicted_numbers": [
        7,
        45,
        18,
        21,
        28
      ],
      "actual_numbers": [
        9,
        41,
        13,
        25,
        31
      ],
      "main_matches": 0,
      "predicted_euro": [
        8,
        2
      ],
      "actual_euro": [
        10,
        5
      ],
      "euro_matches": 0,
      "gewinnklasse": null,
      "method": "ensemble_champion",
      "provider": "ensemble",
      "confidence": 90,
      "strategy": "Gewichtetes Voting aus 21 KI-Vorhersagen"
    },
    {
      "id": "ej_14.01.2026_ml_bayesian_real_1768403410.537508",
      "date": "2026-01-14T15:10:10.537509",
      "draw_date": "14.01.2026",
      "predicted_numbers": [
        10,
        45,
        18,
        25,
        29
      ],
      "actual_numbers": [
        9,
        41,
        13,
        25,
        31
      ],
      "main_matches": 1,
      "predicted_euro": [
        2,
        12
      ],
      "actual_euro": [
        10,
        5
      ],
      "euro_matches": 0,
      "gewinnklasse": null,
      "method": "ml_bayesian_real",
      "provider": "ml_real",
      "confidence": 75,
      "strategy": "Echtes ML: bayesian"
    },
    {
      "id": "ej_14.01.2026_ml_reinforcement_real_1768403410.537544",
      "date": "2026-01-14T15:10:10.537545",
      "draw_date": "14.01.2026",
      "predicted_numbers": [
        45,
        18,
        21,
        24,
        28
      ],
      "actual_numbers": [
        9,
        41,
        13,
        25,
        31
      ],
      "main_matches": 0,
      "predicted_euro": [
        2,
        10
      ],
      "actual_euro": [
        10,
        5
      ],
      "euro_matches": 1,
      "gewinnklasse": null,
      "method": "ml_reinforcement_real",
      "provider": "ml_real",
      "confidence": 75,
      "strategy": "Beste Strategie: ml_ensemble"
    },
    {
      "id": "ej_14.01.2026_ml_markov_real_1768403410.537565",
      "date": "2026-01-14T15:10:10.537566",
      "draw_date": "14.01.2026",
      "predicted_numbers": [
        11,
        45,
        50,
        21,
        22
      ],
      "actual_numbers": [
        9,
        41,
        13,
        25,
        31
      ],
      "main_matches": 0,
      "predicted_euro": [
        2,
        3
      ],
      "actual_euro": [
        10,
        5
      ],
      "euro_matches": 0,
      "gewinnklasse": null,
      "method": "ml_markov_real",
      "provider": "ml_real",
      "confidence": 31.328008519884307,
      "strategy": "Echtes ML: markov"
    },
    {
      "id": "ej_14.01.2026_ml_eurozahl_real_1768403410.537585",
      "date": "2026-01-14T15:10:10.537586",
      "draw_date": "14.01.2026",
      "predicted_numbers": [
        45,
        18,
        21,
        24,
        28
      ],
      "actual_numbers": [
        9,
        41,
        13,
        25,
        31
      ],
      "main_matches": 0,
      "predicted_euro": [
        10,
        4
      ],
      "actual_euro": [
        10,
        5
      ],
      "euro_matches": 1,
      "gewinnklasse": null,
      "method": "ml_eurozahl_real",
      "provider": "ml_real",
      "confidence": 10.411729747876894,
      "strategy": "Spezialisiertes ML f\u00fcr 2 aus 12 mit Paar-Analyse"
    },
    {
      "id": "ej_14.01.2026_ml_neural_network_real_1768403410.537606",
      "date": "2026-01-14T15:10:10.537607",
      "draw_date": "14.01.2026",
      "predicted_numbers": [
        43,
        18,
        21,
        24,
        28
      ],
      "actual_numbers": [
        9,
        41,
        13,
        25,
        31
      ],
      "main_matches": 0,
      "predicted_euro": [
        9,
        10
      ],
      "actual_euro": [
        10,
        5
      ],
      "euro_matches": 1,
      "gewinnklasse": null,
      "method": "ml_neural_network_real",
      "provider": "ml_real",
      "confidence": 2.782532203359953,
      "strategy": "Echtes ML: neural_network"
    },
    {
      "id": "ej_14.01.2026_ej_position_1768403410.53764",
      "date": "2026-01-14T15:10:10.537642",
      "draw_date": "14.01.2026",
      "predicted_numbers": [
        4,
        36,
        47,
        19,
        21
      ],
      "actual_numbers": [
        9,
        41,
        13,
        25,
        31
      ],
      "main_matches": 0,
      "predicted_euro": [
        4,
        12
      ],
      "actual_euro": [
        10,
        5
      ],
      "euro_matches": 0,
      "gewinnklasse": null,
      "method": "ej_position",
      "provider": "local_ml",
      "confidence": 77.0,
      "strategy": "Typische Bereiche pro Position"
    },
    {
      "id": "ej_14.01.2026_ensemble_champion_1768403494.383115",
      "date": "2026-01-14T15:11:34.383137",
      "draw_date": "14.01.2026",
      "predicted_numbers": [
        9,
        46,
        48,
        19,
        23
      ],
      "actual_numbers": [
        35,
        47,
        48,
        50,
        30
      ],
      "main_matches": 1,
      "predicted_euro": [
        2,
        12
      ],
      "actual_euro": [
        12,
        6
      ],
      "euro_matches": 1,
      "gewinnklasse": null,
      "method": "ensemble_champion",
      "provider": "ensemble",
      "confidence": 90,
      "strategy": "Gewichtetes Voting aus 15 KI-Vorhersagen"
    },
    {
      "id": "ej_14.01.2026_ej_no_consecutive_1768403494.383181",
      "date": "2026-01-14T15:11:34.383183",
      "draw_date": "14.01.2026",
      "predicted_numbers": [
        39,
        9,
        46,
        48,
        19
      ],
      "actual_numbers": [
        35,
        47,
        48,
        50,
        30
      ],
      "main_matches": 1,
      "predicted_euro": [
        2,
        12
      ],
      "actual_euro": [
        12,
        6
      ],
      "euro_matches": 1,
      "gewinnklasse": null,
      "method": "ej_no_consecutive",
      "provider": "local_ml",
      "confidence": 77.0,
      "strategy": "Vermeidet aufeinanderfolgende"
    },
    {
      "id": "ej_14.01.2026_ej_low_high_1768403494.383208",
      "date": "2026-01-14T15:11:34.383209",
      "draw_date": "14.01.2026",
      "predicted_numbers": [
        9,
        48,
        19,
        23,
        29
      ],
      "actual_numbers": [
        35,
        47,
        48,
        50,
        30
      ],
      "main_matches": 1,
      "predicted_euro": [
        12,
        5
      ],
      "actual_euro": [
        12,
        6
      ],
      "euro_matches": 1,
      "gewinnklasse": null,
      "method": "ej_low_high",
      "provider": "local_ml",
      "confidence": 77.0,
      "strategy": "3 niedrige + 2 hohe Zahlen"
    },
    {
      "id": "ej_14.01.2026_ej_hot_cold_mix_1768403494.383228",
      "date": "2026-01-14T15:11:34.383229",
      "draw_date": "14.01.2026",
      "predicted_numbers": [
        43,
        15,
        19,
        28,
        29
      ],
      "actual_numbers": [
        35,
        47,
        48,
        50,
        30
      ],
      "main_matches": 0,
      "predicted_euro": [
        4,
        7
      ],
      "actual_euro": [
        12,
        6
      ],
      "euro_matches": 0,
      "gewinnklasse": null,
      "method": "ej_hot_cold_mix",
      "provider": "local_ml",
      "confidence": 77.0,
      "strategy": "3 hei\u00dfe + 2 kalte Zahlen"
    },
    {
      "id": "ej_14.01.2026_ej_monte_carlo_1768403494.383247",
      "date": "2026-01-14T15:11:34.383248",
      "draw_date": "14.01.2026",
      "predicted_numbers": [
        5,
        43,
        46,
        48,
        19
      ],
      "actual_numbers": [
        35,
        47,
        48,
        50,
        30
      ],
      "main_matches": 1,
      "predicted_euro": [
        2,
        6
      ],
      "actual_euro": [
        12,
        6
      ],
      "euro_matches": 1,
      "gewinnklasse": null,
      "method": "ej_monte_carlo",
      "provider": "local_ml",
      "confidence": 77.0,
      "strategy": "1000 Simulationen"
    },
    {
      "id": "ej_14.01.2026_ej_bayesian_1768403494.383267",
      "date": "2026-01-14T15:11:34.383268",
      "draw_date": "14.01.2026",
      "predicted_numbers": [
        2,
        5,
        39,
        9,
        19
      ],
      "actual_numbers": [
        35,
        47,
        48,
        50,
        30
      ],
      "main_matches": 0,
      "predicted_euro": [
        11,
        4
      ],
      "actual_euro": [
        12,
        6
      ],
      "euro_matches": 0,
      "gewinnklasse": null,
      "method": "ej_bayesian",
      "provider": "local_ml",
      "confidence": 77.0,
      "strategy": "Wahrscheinlichkeitsberechnung"
    },
    {
      "id": "ej_14.01.2026_ej_decade_balance_1768403494.383288",
      "date": "2026-01-14T15:11:34.383289",
      "draw_date": "14.01.2026",
      "predicted_numbers": [
        3,
        9,
        43,
        13,
        23
      ],
      "actual_numbers": [
        35,
        47,
        48,
        50,
        30
      ],
      "main_matches": 0,
      "predicted_euro": [
        12,
        6
      ],
      "actual_euro": [
        12,
        6
      ],
      "euro_matches": 2,
      "gewinnklasse": null,
      "method": "ej_decade_balance",
      "provider": "local_ml",
      "confidence": 76.3,
      "strategy": "Verteilt \u00fcber alle 10er-Gruppen"
    },
    {
      "id": "ej_14.01.2026_ej_odd_even_32_1768403494.38332",
      "date": "2026-01-14T15:11:34.383322",
      "draw_date": "14.01.2026",
      "predicted_numbers": [
        35,
        13,
        46,
        48,
        23
      ],
      "actual_numbers": [
        35,
        47,
        48,
        50,
        30
      ],
      "main_matches": 2,
      "predicted_euro": [
        1,
        12
      ],
      "actual_euro": [
        12,
        6
      ],
      "euro_matches": 1,
      "gewinnklasse": 12,
      "method": "ej_odd_even_32",
      "provider": "local_ml",
      "confidence": 76.2,
      "strategy": "Optimale Gerade/Ungerade-Balance"
    },
    {
      "id": "ej_23.01.2026_ml_ensemble_real_1769203298.785701",
      "date": "2026-01-23T21:21:38.785720",
      "draw_date": "23.01.2026",
      "predicted_numbers": [
        9,
        11,
        22,
        24,
        25
      ],
      "actual_numbers": [
        33,
        42,
        14,
        48,
        24
      ],
      "main_matches": 1,
      "predicted_euro": [
        9,
        11
      ],
      "actual_euro": [
        9,
        5
      ],
      "euro_matches": 1,
      "gewinnklasse": null,
      "method": "ml_ensemble_real",
      "provider": "ml_real",
      "confidence": 88,
      "strategy": "Gewichtetes Voting aus Neural Network, Markov, Bayesian & EurozahlML"
    },
    {
      "id": "ej_23.01.2026_ensemble_champion_1769203298.785775",
      "date": "2026-01-23T21:21:38.785782",
      "draw_date": "23.01.2026",
      "predicted_numbers": [
        4,
        11,
        12,
        22,
        25
      ],
      "actual_numbers": [
        33,
        42,
        14,
        48,
        24
      ],
      "main_matches": 0,
      "predicted_euro": [
        9,
        6
      ],
      "actual_euro": [
        9,
        5
      ],
      "euro_matches": 1,
      "gewinnklasse": null,
      "method": "ensemble_champion",
      "provider": "ensemble",
      "confidence": 90,
      "strategy": "Gewichtetes Voting aus 21 KI-Vorhersagen"
    },
    {
      "id": "ej_23.01.2026_ml_bayesian_real_1769203298.785805",
      "date": "2026-01-23T21:21:38.785806",
      "draw_date": "23.01.2026",
      "predicted_numbers": [
        11,
        45,
        22,
        24,
        25
      ],
      "actual_numbers": [
        33,
        42,
        14,
        48,
        24
      ],
      "main_matches": 1,
      "predicted_euro": [
        9,
        2
      ],
      "actual_euro": [
        9,
        5
      ],
      "euro_matches": 1,
      "gewinnklasse": null,
      "method": "ml_bayesian_real",
      "provider": "ml_real",
      "confidence": 75,
      "strategy": "Echtes ML: bayesian"
    },
    {
      "id": "ej_23.01.2026_ml_reinforcement_real_1769203298.785825",
      "date": "2026-01-23T21:21:38.785826",
      "draw_date": "23.01.2026",
      "predicted_numbers": [
        9,
        11,
        22,
        24,
        25
      ],
      "actual_numbers": [
        33,
        42,
        14,
        48,
        24
      ],
      "main_matches": 1,
      "predicted_euro": [
        9,
        11
      ],
      "actual_euro": [
        9,
        5
      ],
      "euro_matches": 1,
      "gewinnklasse": null,
      "method": "ml_reinforcement_real",
      "provider": "ml_real",
      "confidence": 75,
      "strategy": "Beste Strategie: ml_ensemble"
    },
    {
      "id": "ej_23.01.2026_ml_markov_real_1769203298.785861",
      "date": "2026-01-23T21:21:38.785863",
      "draw_date": "23.01.2026",
      "predicted_numbers": [
        38,
        11,
        21,
        22,
        24
      ],
      "actual_numbers": [
        33,
        42,
        14,
        48,
        24
      ],
      "main_matches": 1,
      "predicted_euro": [
        2,
        11
      ],
      "actual_euro": [
        9,
        5
      ],
      "euro_matches": 0,
      "gewinnklasse": null,
      "method": "ml_markov_real",
      "provider": "ml_real",
      "confidence": 29.580523646360387,
      "strategy": "Echtes ML: markov"
    },
    {
      "id": "ej_23.01.2026_ml_eurozahl_real_1769203298.785907",
      "date": "2026-01-23T21:21:38.785908",
      "draw_date": "23.01.2026",
      "predicted_numbers": [
        9,
        11,
        22,
        24,
        25
      ],
      "actual_numbers": [
        33,
        42,
        14,
        48,
        24
      ],
      "main_matches": 1,
      "predicted_euro": [
        9,
        11
      ],
      "actual_euro": [
        9,
        5
      ],
      "euro_matches": 1,
      "gewinnklasse": null,
      "method": "ml_eurozahl_real",
      "provider": "ml_real",
      "confidence": 9.805522628965143,
      "strategy": "Spezialisiertes ML f\u00fcr 2 aus 12 mit Paar-Analyse"
    },
    {
      "id": "ej_23.01.2026_ml_neural_network_real_1769203298.785928",
      "date": "2026-01-23T21:21:38.785929",
      "draw_date": "23.01.2026",
      "predicted_numbers": [
        40,
        9,
        11,
        25,
        28
      ],
      "actual_numbers": [
        33,
        42,
        14,
        48,
        24
      ],
      "main_matches": 0,
      "predicted_euro": [
        9,
        12
      ],
      "actual_euro": [
        9,
        5
      ],
      "euro_matches": 1,
      "gewinnklasse": null,
      "method": "ml_neural_network_real",
      "provider": "ml_real",
      "confidence": 3.5683356280765315,
      "strategy": "Echtes ML: neural_network"
    },
    {
      "id": "ej_23.01.2026_ej_odd_even_32_1769203298.785965",
      "date": "2026-01-23T21:21:38.785966",
      "draw_date": "23.01.2026",
      "predicted_numbers": [
        4,
        7,
        12,
        15,
        19
      ],
      "actual_numbers": [
        33,
        42,
        14,
        48,
        24
      ],
      "main_matches": 0,
      "predicted_euro": [
        12,
        7
      ],
      "actual_euro": [
        9,
        5
      ],
      "euro_matches": 0,
      "gewinnklasse": null,
      "method": "ej_odd_even_32",
      "provider": "local_ml",
      "confidence": 77.9,
      "strategy": "Optimale Gerade/Ungerade-Balance"
    }
  ],
  "stats": {
    "total_entries": 128,
    "avg_main_matches": 0.52,
    "avg_euro_matches": 0.42,
    "three_plus_rate": 0.0,
    "gewinnklasse_rate": 6.25,
    "last_update": "2026-01-23T21:21:38.786090",
    "last_draw": "23.01.2026"
  },
  "by_method": {
    "ensemble_champion": {
      "total_predictions": 15,
      "total_main_matches": 7,
      "total_euro_matches": 7,
      "three_plus": 0,
      "four_plus": 0,
      "five": 0,
      "gewinnklasse_count": 1,
      "main_accuracy": 9.33,
      "euro_accuracy": 23.33,
      "three_plus_rate": 0.0
    },
    "ej_hot_cold": {
      "total_predictions": 2,
      "total_main_matches": 1,
      "total_euro_matches": 1,
      "three_plus": 0,
      "four_plus": 0,
      "five": 0,
      "gewinnklasse_count": 0,
      "main_accuracy": 10.0,
      "euro_accuracy": 25.0,
      "three_plus_rate": 0.0
    },
    "ej_cold": {
      "total_predictions": 2,
      "total_main_matches": 2,
      "total_euro_matches": 0,
      "three_plus": 0,
      "four_plus": 0,
      "five": 0,
      "gewinnklasse_count": 0,
      "main_accuracy": 20.0,
      "euro_accuracy": 0.0,
      "three_plus_rate": 0.0
    },
    "ej_overdue": {
      "total_predictions": 2,
      "total_main_matches": 0,
      "total_euro_matches": 0,
      "three_plus": 0,
      "four_plus": 0,
      "five": 0,
      "gewinnklasse_count": 0,
      "main_accuracy": 0.0,
      "euro_accuracy": 0.0,
      "three_plus_rate": 0.0
    },
    "ej_odd_even_32": {
      "total_predictions": 5,
      "total_main_matches": 6,
      "total_euro_matches": 2,
      "three_plus": 0,
      "four_plus": 0,
      "five": 0,
      "gewinnklasse_count": 2,
      "main_accuracy": 24.0,
      "euro_accuracy": 20.0,
      "three_plus_rate": 0.0
    },
    "ej_odd_even_23": {
      "total_predictions": 2,
      "total_main_matches": 1,
      "total_euro_matches": 1,
      "three_plus": 0,
      "four_plus": 0,
      "five": 0,
      "gewinnklasse_count": 0,
      "main_accuracy": 10.0,
      "euro_accuracy": 25.0,
      "three_plus_rate": 0.0
    },
    "ej_sum_optimized": {
      "total_predictions": 2,
      "total_main_matches": 2,
      "total_euro_matches": 0,
      "three_plus": 0,
      "four_plus": 0,
      "five": 0,
      "gewinnklasse_count": 0,
      "main_accuracy": 20.0,
      "euro_accuracy": 0.0,
      "three_plus_rate": 0.0
    },
    "ej_decade_balance": {
      "total_predictions": 4,
      "total_main_matches": 3,
      "total_euro_matches": 4,
      "three_plus": 0,
      "four_plus": 0,
      "five": 0,
      "gewinnklasse_count": 1,
      "main_accuracy": 15.0,
      "euro_accuracy": 50.0,
      "three_plus_rate": 0.0
    },
    "ej_delta": {
      "total_predictions": 2,
      "total_main_matches": 0,
      "total_euro_matches": 1,
      "three_plus": 0,
      "four_plus": 0,
      "five": 0,
      "gewinnklasse_count": 0,
      "main_accuracy": 0.0,
      "euro_accuracy": 25.0,
      "three_plus_rate": 0.0
    },
    "ej_position": {
      "total_predictions": 2,
      "total_main_matches": 0,
      "total_euro_matches": 0,
      "three_plus": 0,
      "four_plus": 0,
      "five": 0,
      "gewinnklasse_count": 0,
      "main_accuracy": 0.0,
      "euro_accuracy": 0.0,
      "three_plus_rate": 0.0
    },
    "ej_no_consecutive": {
      "total_predictions": 2,
      "total_main_matches": 1,
      "total_euro_matches": 1,
      "three_plus": 0,
      "four_plus": 0,
      "five": 0,
      "gewinnklasse_count": 0,
      "main_accuracy": 10.0,
      "euro_accuracy": 25.0,
      "three_plus_rate": 0.0
    },
    "ej_prime_mix": {
      "total_predictions": 3,
      "total_main_matches": 2,
      "total_euro_matches": 2,
      "three_plus": 0,
      "four_plus": 0,
      "five": 0,
      "gewinnklasse_count": 1,
      "main_accuracy": 13.33,
      "euro_accuracy": 33.33,
      "three_plus_rate": 0.0
    },
    "ej_low_high": {
      "total_predictions": 2,
      "total_main_matches": 1,
      "total_euro_matches": 1,
      "three_plus": 0,
      "four_plus": 0,
      "five": 0,
      "gewinnklasse_count": 0,
      "main_accuracy": 10.0,
      "euro_accuracy": 25.0,
      "three_plus_rate": 0.0
    },
    "ej_hot_cold_mix": {
      "total_predictions": 2,
      "total_main_matches": 0,
      "total_euro_matches": 0,
      "three_plus": 0,
      "four_plus": 0,
      "five": 0,
      "gewinnklasse_count": 0,
      "main_accuracy": 0.0,
      "euro_accuracy": 0.0,
      "three_plus_rate": 0.0
    },
    "ej_monte_carlo": {
      "total_predictions": 2,
      "total_main_matches": 1,
      "total_euro_matches": 1,
      "three_plus": 0,
      "four_plus": 0,
      "five": 0,
      "gewinnklasse_count": 0,
      "main_accuracy": 10.0,
      "euro_accuracy": 25.0,
      "three_plus_rate": 0.0
    },
    "ej_bayesian": {
      "total_predictions": 3,
      "total_main_matches": 3,
      "total_euro_matches": 1,
      "three_plus": 0,
      "four_plus": 0,
      "five": 0,
      "gewinnklasse_count": 0,
      "main_accuracy": 20.0,
      "euro_accuracy": 16.67,
      "three_plus_rate": 0.0
    },
    "ml_ensemble_real": {
      "total_predictions": 13,
      "total_main_matches": 7,
      "total_euro_matches": 6,
      "three_plus": 0,
      "four_plus": 0,
      "five": 0,
      "gewinnklasse_count": 1,
      "main_accuracy": 10.77,
      "euro_accuracy": 23.08,
      "three_plus_rate": 0.0
    },
    "ml_bayesian_real": {
      "total_predictions": 13,
      "total_main_matches": 7,
      "total_euro_matches": 5,
      "three_plus": 0,
      "four_plus": 0,
      "five": 0,
      "gewinnklasse_count": 0,
      "main_accuracy": 10.77,
      "euro_accuracy": 19.23,
      "three_plus_rate": 0.0
    },
    "ml_markov_real": {
      "total_predictions": 13,
      "total_main_matches": 4,
      "total_euro_matches": 5,
      "three_plus": 0,
      "four_plus": 0,
      "five": 0,
      "gewinnklasse_count": 0,
      "main_accuracy": 6.15,
      "euro_accuracy": 19.23,
      "three_plus_rate": 0.0
    },
    "ml_neural_network_real": {
      "total_predictions": 13,
      "total_main_matches": 8,
      "total_euro_matches": 4,
      "three_plus": 0,
      "four_plus": 0,
      "five": 0,
      "gewinnklasse_count": 0,
      "main_accuracy": 12.31,
      "euro_accuracy": 15.38,
      "three_plus_rate": 0.0
    },
    "ml_reinforcement_real": {
      "total_predictions": 12,
      "total_main_matches": 5,
      "total_euro_matches": 6,
      "three_plus": 0,
      "four_plus": 0,
      "five": 0,
      "gewinnklasse_count": 1,
      "main_accuracy": 8.33,
      "euro_accuracy": 25.0,
      "three_plus_rate": 0.0
    },
    "ml_eurozahl_real": {
      "total_predictions": 12,
      "total_main_matches": 5,
      "total_euro_matches": 6,
      "three_plus": 0,
      "four_plus": 0,
      "five": 0,
      "gewinnklasse_count": 1,
      "main_accuracy": 8.33,
      "euro_accuracy": 25.0,
      "three_plus_rate": 0.0
    }
  },
  "by_provider": {},
  "gewinnklassen": {
    "12": 6,
    "8": 1,
    "11": 1
  }
}